Trial 0 finished with values: [8.043825817108154, 0.7468937397003174] and parameters: {'resnet2d_inplanes_0': 39, 'resnet3d_inplanes_0': 31, 'resnet2d_inplanes_1': 49, 'resnet3d_inplanes_1': 18, 'resnet2d_inplanes_2': 37, 'resnet3d_inplanes_2': 27, 'optimizer': 'Adam', 'lr': 6.330615562006416e-05, 'weight_decay': 2.505878748516921e-05, 'batch_size': 3}. 
Trial 1 finished with values: [27.758554935455322, 1.0] and parameters: {'resnet2d_inplanes_0': 36, 'resnet3d_inplanes_0': 26, 'resnet2d_inplanes_1': 34, 'resnet3d_inplanes_1': 17, 'resnet2d_inplanes_2': 47, 'resnet3d_inplanes_2': 26, 'optimizer': 'SGD', 'lr': 0.054502154112189304, 'weight_decay': 1.4240904099039253e-05, 'batch_size': 5}. 
Trial 2 finished with values: [8.533979960850306, 0.7572424752371651] and parameters: {'resnet2d_inplanes_0': 52, 'resnet3d_inplanes_0': 20, 'resnet2d_inplanes_1': 42, 'resnet3d_inplanes_1': 31, 'resnet2d_inplanes_2': 42, 'resnet3d_inplanes_2': 23, 'optimizer': 'Adam', 'lr': 8.216392585254432e-05, 'weight_decay': 0.005600787886868945, 'batch_size': 2}. 
Trial 3 finished with values: [14.313141107559204, 0.9019376933574677] and parameters: {'resnet2d_inplanes_0': 41, 'resnet3d_inplanes_0': 29, 'resnet2d_inplanes_1': 62, 'resnet3d_inplanes_1': 17, 'resnet2d_inplanes_2': 54, 'resnet3d_inplanes_2': 24, 'optimizer': 'Adam', 'lr': 0.030294095196122153, 'weight_decay': 0.00022871223183994454, 'batch_size': 5}. 
Trial 4 finished with values: [9.000881791114807, 0.7884614318609238] and parameters: {'resnet2d_inplanes_0': 42, 'resnet3d_inplanes_0': 16, 'resnet2d_inplanes_1': 48, 'resnet3d_inplanes_1': 20, 'resnet2d_inplanes_2': 48, 'resnet3d_inplanes_2': 29, 'optimizer': 'Adam', 'lr': 0.0005683303703095466, 'weight_decay': 0.0004455048522935195, 'batch_size': 5}. 
Trial 5 finished with values: [10.598579134259905, 0.805588960647583] and parameters: {'resnet2d_inplanes_0': 51, 'resnet3d_inplanes_0': 18, 'resnet2d_inplanes_1': 35, 'resnet3d_inplanes_1': 29, 'resnet2d_inplanes_2': 55, 'resnet3d_inplanes_2': 32, 'optimizer': 'Adam', 'lr': 0.004918570640544764, 'weight_decay': 6.931167334491954e-06, 'batch_size': 2}. 
Trial 6 finished with values: [12.79697585105896, 0.854850560426712] and parameters: {'resnet2d_inplanes_0': 64, 'resnet3d_inplanes_0': 24, 'resnet2d_inplanes_1': 56, 'resnet3d_inplanes_1': 21, 'resnet2d_inplanes_2': 32, 'resnet3d_inplanes_2': 23, 'optimizer': 'SGD', 'lr': 3.60925157040683e-05, 'weight_decay': 0.00039047785098329535, 'batch_size': 4}. 
Trial 7 finished with values: [10.146018266677856, 0.7825794070959091] and parameters: {'resnet2d_inplanes_0': 36, 'resnet3d_inplanes_0': 28, 'resnet2d_inplanes_1': 38, 'resnet3d_inplanes_1': 22, 'resnet2d_inplanes_2': 42, 'resnet3d_inplanes_2': 16, 'optimizer': 'RMSprop', 'lr': 0.0001438250757154593, 'weight_decay': 0.0011278559366477829, 'batch_size': 4}. 
Trial 8 finished with values: [7.948485255241394, 0.7435398399829865] and parameters: {'resnet2d_inplanes_0': 52, 'resnet3d_inplanes_0': 17, 'resnet2d_inplanes_1': 33, 'resnet3d_inplanes_1': 28, 'resnet2d_inplanes_2': 60, 'resnet3d_inplanes_2': 16, 'optimizer': 'Adam', 'lr': 0.0011516648502399862, 'weight_decay': 0.0005530736968432427, 'batch_size': 5}. 
Trial 9 finished with values: [15.47846794128418, 0.8524974882602692] and parameters: {'resnet2d_inplanes_0': 44, 'resnet3d_inplanes_0': 31, 'resnet2d_inplanes_1': 54, 'resnet3d_inplanes_1': 30, 'resnet2d_inplanes_2': 38, 'resnet3d_inplanes_2': 29, 'optimizer': 'SGD', 'lr': 1.3218448008240333e-05, 'weight_decay': 1.8234021503587142e-06, 'batch_size': 4}. 
Trial 10 finished with values: [11.206478357315063, 0.8063328713178635] and parameters: {'resnet2d_inplanes_0': 36, 'resnet3d_inplanes_0': 18, 'resnet2d_inplanes_1': 46, 'resnet3d_inplanes_1': 28, 'resnet2d_inplanes_2': 42, 'resnet3d_inplanes_2': 23, 'optimizer': 'RMSprop', 'lr': 0.009332250932902802, 'weight_decay': 4.2075617735802614e-05, 'batch_size': 5}. 
Trial 11 finished with values: [9.361807346343994, 0.7984281629323959] and parameters: {'resnet2d_inplanes_0': 32, 'resnet3d_inplanes_0': 16, 'resnet2d_inplanes_1': 46, 'resnet3d_inplanes_1': 18, 'resnet2d_inplanes_2': 52, 'resnet3d_inplanes_2': 23, 'optimizer': 'SGD', 'lr': 2.8751342477511235e-05, 'weight_decay': 1.7378940536555563e-06, 'batch_size': 4}. 
Trial 12 finished with values: [11.386473417282104, 0.8286471515893936] and parameters: {'resnet2d_inplanes_0': 37, 'resnet3d_inplanes_0': 29, 'resnet2d_inplanes_1': 62, 'resnet3d_inplanes_1': 32, 'resnet2d_inplanes_2': 55, 'resnet3d_inplanes_2': 16, 'optimizer': 'SGD', 'lr': 0.0032876745158818225, 'weight_decay': 2.1927765117798513e-05, 'batch_size': 4}. 
Trial 13 finished with values: [8.611387848854065, 0.817052572965622] and parameters: {'resnet2d_inplanes_0': 35, 'resnet3d_inplanes_0': 17, 'resnet2d_inplanes_1': 53, 'resnet3d_inplanes_1': 28, 'resnet2d_inplanes_2': 60, 'resnet3d_inplanes_2': 29, 'optimizer': 'Adam', 'lr': 0.0052676278442144175, 'weight_decay': 0.009865389502042288, 'batch_size': 4}. 
Trial 14 finished with values: [10.316419506072998, 0.793289041519165] and parameters: {'resnet2d_inplanes_0': 44, 'resnet3d_inplanes_0': 30, 'resnet2d_inplanes_1': 50, 'resnet3d_inplanes_1': 24, 'resnet2d_inplanes_2': 46, 'resnet3d_inplanes_2': 24, 'optimizer': 'SGD', 'lr': 0.025162185420290865, 'weight_decay': 0.00011731215247938805, 'batch_size': 3}. 
Trial 15 finished with values: [8.803503155708313, 0.793389156460762] and parameters: {'resnet2d_inplanes_0': 46, 'resnet3d_inplanes_0': 24, 'resnet2d_inplanes_1': 44, 'resnet3d_inplanes_1': 23, 'resnet2d_inplanes_2': 32, 'resnet3d_inplanes_2': 29, 'optimizer': 'Adam', 'lr': 0.00010637489652267575, 'weight_decay': 0.0040238155705681995, 'batch_size': 4}. 
Trial 16 finished with values: [10.413370370864868, 0.829599991440773] and parameters: {'resnet2d_inplanes_0': 55, 'resnet3d_inplanes_0': 29, 'resnet2d_inplanes_1': 60, 'resnet3d_inplanes_1': 26, 'resnet2d_inplanes_2': 54, 'resnet3d_inplanes_2': 23, 'optimizer': 'SGD', 'lr': 0.018915755222862273, 'weight_decay': 0.002128417170269629, 'batch_size': 4}. 
Trial 17 finished with values: [8.632184624671936, 0.7829378843307495] and parameters: {'resnet2d_inplanes_0': 39, 'resnet3d_inplanes_0': 16, 'resnet2d_inplanes_1': 49, 'resnet3d_inplanes_1': 26, 'resnet2d_inplanes_2': 58, 'resnet3d_inplanes_2': 20, 'optimizer': 'RMSprop', 'lr': 4.181710526582624e-05, 'weight_decay': 0.0041904770765763015, 'batch_size': 5}. 
Trial 18 finished with values: [7.745210375104632, 0.7794549635478428] and parameters: {'resnet2d_inplanes_0': 36, 'resnet3d_inplanes_0': 28, 'resnet2d_inplanes_1': 55, 'resnet3d_inplanes_1': 17, 'resnet2d_inplanes_2': 61, 'resnet3d_inplanes_2': 30, 'optimizer': 'Adam', 'lr': 0.0008882136680866258, 'weight_decay': 0.00041412711575945576, 'batch_size': 2}. 
Trial 19 finished with values: [9.299769639968872, 0.8005721867084503] and parameters: {'resnet2d_inplanes_0': 32, 'resnet3d_inplanes_0': 29, 'resnet2d_inplanes_1': 36, 'resnet3d_inplanes_1': 25, 'resnet2d_inplanes_2': 51, 'resnet3d_inplanes_2': 17, 'optimizer': 'Adam', 'lr': 0.00018943615050451143, 'weight_decay': 0.00032657025911728263, 'batch_size': 5}. 
Trial 20 finished with values: [10.146339416503906, 0.8312710970640182] and parameters: {'resnet2d_inplanes_0': 36, 'resnet3d_inplanes_0': 28, 'resnet2d_inplanes_1': 44, 'resnet3d_inplanes_1': 26, 'resnet2d_inplanes_2': 47, 'resnet3d_inplanes_2': 24, 'optimizer': 'SGD', 'lr': 0.00012015949473786927, 'weight_decay': 2.109734419668891e-06, 'batch_size': 4}. 
Trial 21 finished with values: [24.38729558672224, 0.994165701525552] and parameters: {'resnet2d_inplanes_0': 33, 'resnet3d_inplanes_0': 27, 'resnet2d_inplanes_1': 51, 'resnet3d_inplanes_1': 19, 'resnet2d_inplanes_2': 32, 'resnet3d_inplanes_2': 20, 'optimizer': 'Adam', 'lr': 0.04026038951696784, 'weight_decay': 4.474308813764254e-05, 'batch_size': 2}. 
Trial 22 finished with values: [25.825275897979736, 1.0] and parameters: {'resnet2d_inplanes_0': 38, 'resnet3d_inplanes_0': 27, 'resnet2d_inplanes_1': 58, 'resnet3d_inplanes_1': 26, 'resnet2d_inplanes_2': 45, 'resnet3d_inplanes_2': 21, 'optimizer': 'SGD', 'lr': 0.011229369229688018, 'weight_decay': 0.0017548791011994342, 'batch_size': 5}. 
Trial 23 finished with values: [11.202516317367554, 0.8297180980443954] and parameters: {'resnet2d_inplanes_0': 32, 'resnet3d_inplanes_0': 31, 'resnet2d_inplanes_1': 57, 'resnet3d_inplanes_1': 31, 'resnet2d_inplanes_2': 50, 'resnet3d_inplanes_2': 19, 'optimizer': 'SGD', 'lr': 0.07364132921563722, 'weight_decay': 3.5801054955154386e-06, 'batch_size': 4}. 
Trial 24 finished with values: [10.615580081939697, 0.8191762225968497] and parameters: {'resnet2d_inplanes_0': 61, 'resnet3d_inplanes_0': 32, 'resnet2d_inplanes_1': 32, 'resnet3d_inplanes_1': 25, 'resnet2d_inplanes_2': 61, 'resnet3d_inplanes_2': 29, 'optimizer': 'Adam', 'lr': 0.015758060990048294, 'weight_decay': 2.674083235550174e-06, 'batch_size': 2}. 
Trial 25 finished with values: [10.956055736541748, 0.8308880448341369] and parameters: {'resnet2d_inplanes_0': 41, 'resnet3d_inplanes_0': 24, 'resnet2d_inplanes_1': 60, 'resnet3d_inplanes_1': 25, 'resnet2d_inplanes_2': 37, 'resnet3d_inplanes_2': 25, 'optimizer': 'RMSprop', 'lr': 5.036277779110354e-05, 'weight_decay': 7.609397670644767e-05, 'batch_size': 3}. 
Trial 26 finished with values: [12.555792999267577, 0.8239766240119935] and parameters: {'resnet2d_inplanes_0': 46, 'resnet3d_inplanes_0': 22, 'resnet2d_inplanes_1': 59, 'resnet3d_inplanes_1': 27, 'resnet2d_inplanes_2': 56, 'resnet3d_inplanes_2': 27, 'optimizer': 'RMSprop', 'lr': 0.0003528341429771979, 'weight_decay': 5.342844206469288e-06, 'batch_size': 3}. 
Trial 27 finished with values: [10.662966319492885, 0.8294678500720433] and parameters: {'resnet2d_inplanes_0': 39, 'resnet3d_inplanes_0': 30, 'resnet2d_inplanes_1': 52, 'resnet3d_inplanes_1': 22, 'resnet2d_inplanes_2': 46, 'resnet3d_inplanes_2': 30, 'optimizer': 'Adam', 'lr': 0.058308261280741285, 'weight_decay': 2.8278279315570008e-05, 'batch_size': 2}. 
Trial 28 finished with values: [15.082123374938964, 0.8474731087684632] and parameters: {'resnet2d_inplanes_0': 64, 'resnet3d_inplanes_0': 20, 'resnet2d_inplanes_1': 59, 'resnet3d_inplanes_1': 23, 'resnet2d_inplanes_2': 50, 'resnet3d_inplanes_2': 31, 'optimizer': 'SGD', 'lr': 0.002052413003294124, 'weight_decay': 6.190567178420045e-05, 'batch_size': 3}. 
Trial 29 finished with values: [11.504350185394287, 0.8585130274295807] and parameters: {'resnet2d_inplanes_0': 38, 'resnet3d_inplanes_0': 19, 'resnet2d_inplanes_1': 32, 'resnet3d_inplanes_1': 23, 'resnet2d_inplanes_2': 54, 'resnet3d_inplanes_2': 28, 'optimizer': 'SGD', 'lr': 5.8323439996696084e-05, 'weight_decay': 3.853917558475407e-05, 'batch_size': 4}. 
Trial 30 finished with values: [8.656958937644958, 0.7922691404819489] and parameters: {'resnet2d_inplanes_0': 36, 'resnet3d_inplanes_0': 25, 'resnet2d_inplanes_1': 50, 'resnet3d_inplanes_1': 29, 'resnet2d_inplanes_2': 34, 'resnet3d_inplanes_2': 27, 'optimizer': 'RMSprop', 'lr': 1.4289468591608565e-05, 'weight_decay': 0.0013941205906786627, 'batch_size': 5}. 
Trial 31 finished with values: [19.918735231672013, 0.9494263359478542] and parameters: {'resnet2d_inplanes_0': 60, 'resnet3d_inplanes_0': 27, 'resnet2d_inplanes_1': 48, 'resnet3d_inplanes_1': 22, 'resnet2d_inplanes_2': 52, 'resnet3d_inplanes_2': 19, 'optimizer': 'SGD', 'lr': 0.015466949368578594, 'weight_decay': 3.305140760790167e-05, 'batch_size': 2}. 
Trial 32 finished with values: [12.33311424255371, 0.8419148445129394] and parameters: {'resnet2d_inplanes_0': 53, 'resnet3d_inplanes_0': 16, 'resnet2d_inplanes_1': 61, 'resnet3d_inplanes_1': 23, 'resnet2d_inplanes_2': 38, 'resnet3d_inplanes_2': 22, 'optimizer': 'Adam', 'lr': 3.2620843680233216e-05, 'weight_decay': 0.0001348490107273143, 'batch_size': 3}. 
Trial 33 finished with values: [14.435978507995605, 0.8455728769302369] and parameters: {'resnet2d_inplanes_0': 35, 'resnet3d_inplanes_0': 21, 'resnet2d_inplanes_1': 36, 'resnet3d_inplanes_1': 32, 'resnet2d_inplanes_2': 48, 'resnet3d_inplanes_2': 27, 'optimizer': 'SGD', 'lr': 0.00010238391675634789, 'weight_decay': 6.685436440521994e-05, 'batch_size': 3}. 
Trial 34 finished with values: [11.929210901260376, 0.8126328885555267] and parameters: {'resnet2d_inplanes_0': 62, 'resnet3d_inplanes_0': 17, 'resnet2d_inplanes_1': 51, 'resnet3d_inplanes_1': 18, 'resnet2d_inplanes_2': 45, 'resnet3d_inplanes_2': 19, 'optimizer': 'SGD', 'lr': 0.0002059697440795347, 'weight_decay': 4.9362561536712196e-06, 'batch_size': 5}. 
Trial 35 finished with values: [7.432455658912659, 0.7397665977478027] and parameters: {'resnet2d_inplanes_0': 49, 'resnet3d_inplanes_0': 20, 'resnet2d_inplanes_1': 32, 'resnet3d_inplanes_1': 19, 'resnet2d_inplanes_2': 48, 'resnet3d_inplanes_2': 25, 'optimizer': 'Adam', 'lr': 0.0003311732910611122, 'weight_decay': 0.004917319215620713, 'batch_size': 5}. 
Trial 36 finished with values: [9.064515658787318, 0.7695111972945077] and parameters: {'resnet2d_inplanes_0': 57, 'resnet3d_inplanes_0': 30, 'resnet2d_inplanes_1': 34, 'resnet3d_inplanes_1': 32, 'resnet2d_inplanes_2': 64, 'resnet3d_inplanes_2': 16, 'optimizer': 'SGD', 'lr': 3.0210446225153592e-05, 'weight_decay': 0.004586289376124436, 'batch_size': 2}. 
Trial 37 finished with values: [11.033482909202576, 0.8219312578439713] and parameters: {'resnet2d_inplanes_0': 45, 'resnet3d_inplanes_0': 17, 'resnet2d_inplanes_1': 33, 'resnet3d_inplanes_1': 26, 'resnet2d_inplanes_2': 34, 'resnet3d_inplanes_2': 30, 'optimizer': 'RMSprop', 'lr': 8.159194313742829e-05, 'weight_decay': 8.4335112798632e-06, 'batch_size': 5}. 
Trial 38 finished with values: [11.681529426574707, 0.831417715549469] and parameters: {'resnet2d_inplanes_0': 37, 'resnet3d_inplanes_0': 25, 'resnet2d_inplanes_1': 43, 'resnet3d_inplanes_1': 27, 'resnet2d_inplanes_2': 62, 'resnet3d_inplanes_2': 32, 'optimizer': 'Adam', 'lr': 2.4136633487601786e-05, 'weight_decay': 4.486726546954734e-06, 'batch_size': 3}. 
Trial 39 finished with values: [9.32661485671997, 0.8311626464128494] and parameters: {'resnet2d_inplanes_0': 53, 'resnet3d_inplanes_0': 30, 'resnet2d_inplanes_1': 59, 'resnet3d_inplanes_1': 28, 'resnet2d_inplanes_2': 57, 'resnet3d_inplanes_2': 24, 'optimizer': 'RMSprop', 'lr': 0.0020638973946346564, 'weight_decay': 0.0006754269426576557, 'batch_size': 4}. 
Trial 40 finished with values: [9.633577585220337, 0.8261870294809341] and parameters: {'resnet2d_inplanes_0': 41, 'resnet3d_inplanes_0': 32, 'resnet2d_inplanes_1': 34, 'resnet3d_inplanes_1': 21, 'resnet2d_inplanes_2': 54, 'resnet3d_inplanes_2': 19, 'optimizer': 'RMSprop', 'lr': 0.0036520845197504934, 'weight_decay': 5.416968762905651e-05, 'batch_size': 4}. 
Trial 41 finished with values: [11.751611709594727, 0.8076068609952927] and parameters: {'resnet2d_inplanes_0': 38, 'resnet3d_inplanes_0': 32, 'resnet2d_inplanes_1': 55, 'resnet3d_inplanes_1': 32, 'resnet2d_inplanes_2': 44, 'resnet3d_inplanes_2': 27, 'optimizer': 'Adam', 'lr': 3.2776138380251444e-05, 'weight_decay': 2.4548136423498254e-06, 'batch_size': 4}. 
Trial 42 finished with values: [8.847898364067078, 0.7912565767765045] and parameters: {'resnet2d_inplanes_0': 46, 'resnet3d_inplanes_0': 29, 'resnet2d_inplanes_1': 64, 'resnet3d_inplanes_1': 25, 'resnet2d_inplanes_2': 53, 'resnet3d_inplanes_2': 17, 'optimizer': 'SGD', 'lr': 0.0001506854935595076, 'weight_decay': 0.0002976816554392442, 'batch_size': 4}. 
Trial 43 finished with values: [11.305170726776122, 0.840206241607666] and parameters: {'resnet2d_inplanes_0': 33, 'resnet3d_inplanes_0': 29, 'resnet2d_inplanes_1': 47, 'resnet3d_inplanes_1': 29, 'resnet2d_inplanes_2': 56, 'resnet3d_inplanes_2': 20, 'optimizer': 'Adam', 'lr': 0.0004408847038308015, 'weight_decay': 3.0327955205156674e-05, 'batch_size': 3}. 
Trial 44 finished with values: [15.882384872436523, 0.8669474482536316] and parameters: {'resnet2d_inplanes_0': 36, 'resnet3d_inplanes_0': 30, 'resnet2d_inplanes_1': 38, 'resnet3d_inplanes_1': 20, 'resnet2d_inplanes_2': 49, 'resnet3d_inplanes_2': 22, 'optimizer': 'RMSprop', 'lr': 0.030536382066256057, 'weight_decay': 0.0006530185079447909, 'batch_size': 3}. 
Trial 45 finished with values: [25.277933502197264, 1.0] and parameters: {'resnet2d_inplanes_0': 64, 'resnet3d_inplanes_0': 16, 'resnet2d_inplanes_1': 37, 'resnet3d_inplanes_1': 19, 'resnet2d_inplanes_2': 46, 'resnet3d_inplanes_2': 18, 'optimizer': 'SGD', 'lr': 0.013380249984734544, 'weight_decay': 0.000647202461826359, 'batch_size': 3}. 
Trial 46 finished with values: [9.50198154449463, 0.8059316277503967] and parameters: {'resnet2d_inplanes_0': 38, 'resnet3d_inplanes_0': 24, 'resnet2d_inplanes_1': 37, 'resnet3d_inplanes_1': 17, 'resnet2d_inplanes_2': 57, 'resnet3d_inplanes_2': 30, 'optimizer': 'Adam', 'lr': 7.128790478344418e-05, 'weight_decay': 0.0011559355102396178, 'batch_size': 3}. 
Trial 47 finished with values: [10.689822959899903, 0.846987497806549] and parameters: {'resnet2d_inplanes_0': 44, 'resnet3d_inplanes_0': 29, 'resnet2d_inplanes_1': 48, 'resnet3d_inplanes_1': 28, 'resnet2d_inplanes_2': 56, 'resnet3d_inplanes_2': 26, 'optimizer': 'Adam', 'lr': 0.013506579943797555, 'weight_decay': 8.549345482151239e-05, 'batch_size': 3}. 
Trial 48 finished with values: [9.425245761871338, 0.8218436002731323] and parameters: {'resnet2d_inplanes_0': 59, 'resnet3d_inplanes_0': 23, 'resnet2d_inplanes_1': 58, 'resnet3d_inplanes_1': 28, 'resnet2d_inplanes_2': 56, 'resnet3d_inplanes_2': 29, 'optimizer': 'Adam', 'lr': 3.51131041657101e-05, 'weight_decay': 0.00018085240129573537, 'batch_size': 3}. 
Trial 49 finished with values: [11.395252466201782, 0.8405176401138306] and parameters: {'resnet2d_inplanes_0': 40, 'resnet3d_inplanes_0': 29, 'resnet2d_inplanes_1': 59, 'resnet3d_inplanes_1': 27, 'resnet2d_inplanes_2': 60, 'resnet3d_inplanes_2': 22, 'optimizer': 'SGD', 'lr': 8.300778566392739e-05, 'weight_decay': 4.36897662431666e-05, 'batch_size': 4}. 
Trial 50 finished with values: [7.536319732666016, 0.7245403613362994] and parameters: {'resnet2d_inplanes_0': 42, 'resnet3d_inplanes_0': 16, 'resnet2d_inplanes_1': 48, 'resnet3d_inplanes_1': 20, 'resnet2d_inplanes_2': 61, 'resnet3d_inplanes_2': 29, 'optimizer': 'Adam', 'lr': 0.0005683303703095466, 'weight_decay': 0.0004455048522935195, 'batch_size': 2}. 
Trial 51 finished with values: [9.21352584021432, 0.8352662920951843] and parameters: {'resnet2d_inplanes_0': 36, 'resnet3d_inplanes_0': 30, 'resnet2d_inplanes_1': 55, 'resnet3d_inplanes_1': 28, 'resnet2d_inplanes_2': 57, 'resnet3d_inplanes_2': 30, 'optimizer': 'Adam', 'lr': 0.0008882136680866258, 'weight_decay': 0.00041412711575945576, 'batch_size': 2}. 
Trial 52 finished with values: [9.186693286895752, 0.8113104462623596] and parameters: {'resnet2d_inplanes_0': 44, 'resnet3d_inplanes_0': 29, 'resnet2d_inplanes_1': 47, 'resnet3d_inplanes_1': 29, 'resnet2d_inplanes_2': 46, 'resnet3d_inplanes_2': 20, 'optimizer': 'SGD', 'lr': 0.0004408847038308015, 'weight_decay': 0.00011731215247938805, 'batch_size': 3}. 
Trial 53 finished with values: [8.479660868644714, 0.7986481040716171] and parameters: {'resnet2d_inplanes_0': 38, 'resnet3d_inplanes_0': 28, 'resnet2d_inplanes_1': 37, 'resnet3d_inplanes_1': 17, 'resnet2d_inplanes_2': 57, 'resnet3d_inplanes_2': 24, 'optimizer': 'Adam', 'lr': 7.128790478344418e-05, 'weight_decay': 2.109734419668891e-06, 'batch_size': 4}. 
Trial 54 finished with values: [9.459323024749756, 0.7674854040145874] and parameters: {'resnet2d_inplanes_0': 46, 'resnet3d_inplanes_0': 31, 'resnet2d_inplanes_1': 44, 'resnet3d_inplanes_1': 29, 'resnet2d_inplanes_2': 37, 'resnet3d_inplanes_2': 27, 'optimizer': 'Adam', 'lr': 6.330615562006416e-05, 'weight_decay': 2.505878748516921e-05, 'batch_size': 3}. 
Trial 55 finished with values: [8.329620293208531, 0.8143450021743774] and parameters: {'resnet2d_inplanes_0': 36, 'resnet3d_inplanes_0': 28, 'resnet2d_inplanes_1': 44, 'resnet3d_inplanes_1': 28, 'resnet2d_inplanes_2': 47, 'resnet3d_inplanes_2': 24, 'optimizer': 'SGD', 'lr': 0.00012015949473786927, 'weight_decay': 2.1927765117798513e-05, 'batch_size': 2}. 
Trial 56 finished with values: [10.778508567810059, 0.8460112094879151] and parameters: {'resnet2d_inplanes_0': 44, 'resnet3d_inplanes_0': 24, 'resnet2d_inplanes_1': 50, 'resnet3d_inplanes_1': 17, 'resnet2d_inplanes_2': 57, 'resnet3d_inplanes_2': 27, 'optimizer': 'Adam', 'lr': 0.025162185420290865, 'weight_decay': 0.00011731215247938805, 'batch_size': 3}. 
Trial 57 finished with values: [7.785090827941895, 0.7503579974174499] and parameters: {'resnet2d_inplanes_0': 38, 'resnet3d_inplanes_0': 21, 'resnet2d_inplanes_1': 36, 'resnet3d_inplanes_1': 32, 'resnet2d_inplanes_2': 57, 'resnet3d_inplanes_2': 27, 'optimizer': 'Adam', 'lr': 7.128790478344418e-05, 'weight_decay': 0.00039629945852066574, 'batch_size': 3}. 
Trial 58 finished with values: [22.014925820486887, 0.9197018487112862] and parameters: {'resnet2d_inplanes_0': 56, 'resnet3d_inplanes_0': 30, 'resnet2d_inplanes_1': 62, 'resnet3d_inplanes_1': 32, 'resnet2d_inplanes_2': 54, 'resnet3d_inplanes_2': 24, 'optimizer': 'SGD', 'lr': 0.030294095196122153, 'weight_decay': 0.00022871223183994454, 'batch_size': 2}. 
Trial 59 finished with values: [9.565236364092145, 0.7710379958152771] and parameters: {'resnet2d_inplanes_0': 52, 'resnet3d_inplanes_0': 20, 'resnet2d_inplanes_1': 32, 'resnet3d_inplanes_1': 19, 'resnet2d_inplanes_2': 55, 'resnet3d_inplanes_2': 23, 'optimizer': 'Adam', 'lr': 8.216392585254432e-05, 'weight_decay': 5.237750210028175e-06, 'batch_size': 2}. 
Trial 60 finished with values: [10.562763214111328, 0.8308472514152527] and parameters: {'resnet2d_inplanes_0': 36, 'resnet3d_inplanes_0': 25, 'resnet2d_inplanes_1': 43, 'resnet3d_inplanes_1': 27, 'resnet2d_inplanes_2': 61, 'resnet3d_inplanes_2': 30, 'optimizer': 'Adam', 'lr': 2.4136633487601786e-05, 'weight_decay': 4.486726546954734e-06, 'batch_size': 3}. 
